Assurer la gestion financière et comptable;Assurer la production des comptes;Assurer la production des comptes;SNT DFC \ DPC;Elaborer les états financiers;Risque de retard de publication de l'information pour le pilotage;Retard de saisie des pièces comptables;;;;;;;;"Objectif de chargement des journées comptables suivi via le TdB de DFC/DPC/CAU avec des relances hebdomadaires des agences commerciales retardataires 
Etat des journées comptables tirée hebdomadairement pour relance
suivi des vacation par DIS et CAU hebdo
Suivi quotidien des pièces non imputées au niveau de la compta géné quotidien";Détectif;Manuelle;1;2;1;;4;1;;2;3;;;;;;;;;;;;;;;;;;;;;;;;;;;;;;;;;;;;;;;;;;;;;;;;;;;;;;;;;;;;;;;;;;;;;;;;;;;;;;;;;;;;;;;;;;;;;;;;;;;;;;;;;;;;;;;;;;;;;;;;;;;;;;;;;;;;;;;;;;;;;;;;;;;;;;;;;;;;;;;;;;;;;;;;;;;;;;;;;;;;;;;;;;;;;;;;;;;;;;;;;;;;;;;;;;;;;;;;;;;;;;;;;;;;;;;;;;;;;;;;;;;;;;;;;;;;;;;;;;;;;;;;;;;;;;;;;;;;;;;;;;;;;;;;;;;;;;;;;;;;;;;;;;;;;;;;;;;;;;;;;;;;;;;;;;;;;;;;;;;;;;;;;;;;;;;;;;;;;;;;;;;;;;;;;;;;;;;;;;;;;;;;;;;;;;;;;;;;;;;;;;;;;;;;;;;;;;;;;;;;;;;;;;;;;;;;;;;;;;;;;;;;;;;;;;;;;;;;;;;;;;;;;;;;;;;;;;;;;;;;;;;;;;;;;;;;;;;;;;;;;;;;;;;;;;;;;;;;;;;;;;;;;;;;;;;;;;;;;;;;;;;;;;;;;;;;;;;;;;;;;;;;;;;;;;;;;;;;;;;;;;;;;;;;;;;;;;;;;;;;;;;;;;;;;;;;;;;;;;;;;;;;;;;;;;;;;;;;;;;;;;;;;;;;;;;;;;;;;;;;;;;;;;;;;;;;;;;;;;;;;;;;;;;;;;;;;;;;;;;;;;;;;;;;;;;;;;;;;;;;;;;;;;;;;;;;;;;;;;;;;;;;;;;;;;;;;;;;;;;;;;;;;;;;;;;;;;;;;;;;;;;;;;
Assurer la gestion financière et comptable;Assurer la production des comptes;Assurer la production des comptes;SNT DFC \ DPC;Elaborer les états financiers;Risque de retard de publication de l'information pour le pilotage;Défaillance SI;;;;;;;;Planification en relation avec DPC et SMP pour les travaux de maintenance en fonction du planning d'arrêté des comptes;Préventif;Manuelle;1;2;1;;4;1;;2;3;;;;;;;;;;;;;;;;;;;;;;;;;;;;;;;;;;;;;;;;;;;;;;;;;;;;;;;;;;;;;;;;;;;;;;;;;;;;;;;;;;;;;;;;;;;;;;;;;;;;;;;;;;;;;;;;;;;;;;;;;;;;;;;;;;;;;;;;;;;;;;;;;;;;;;;;;;;;;;;;;;;;;;;;;;;;;;;;;;;;;;;;;;;;;;;;;;;;;;;;;;;;;;;;;;;;;;;;;;;;;;;;;;;;;;;;;;;;;;;;;;;;;;;;;;;;;;;;;;;;;;;;;;;;;;;;;;;;;;;;;;;;;;;;;;;;;;;;;;;;;;;;;;;;;;;;;;;;;;;;;;;;;;;;;;;;;;;;;;;;;;;;;;;;;;;;;;;;;;;;;;;;;;;;;;;;;;;;;;;;;;;;;;;;;;;;;;;;;;;;;;;;;;;;;;;;;;;;;;;;;;;;;;;;;;;;;;;;;;;;;;;;;;;;;;;;;;;;;;;;;;;;;;;;;;;;;;;;;;;;;;;;;;;;;;;;;;;;;;;;;;;;;;;;;;;;;;;;;;;;;;;;;;;;;;;;;;;;;;;;;;;;;;;;;;;;;;;;;;;;;;;;;;;;;;;;;;;;;;;;;;;;;;;;;;;;;;;;;;;;;;;;;;;;;;;;;;;;;;;;;;;;;;;;;;;;;;;;;;;;;;;;;;;;;;;;;;;;;;;;;;;;;;;;;;;;;;;;;;;;;;;;;;;;;;;;;;;;;;;;;;;;;;;;;;;;;;;;;;;;;;;;;;;;;;;;;;;;;;;;;;;;;;;;;;;;;;;;;;;;;;;;;;;;;;;;;;;;;;;;;;;;;;
Assurer la gestion financière et comptable;Assurer la production des comptes;Assurer la production des comptes;SNT DFC \ DPC;Elaborer les états financiers;Risque de retard de publication de l'information pour le pilotage;Non respect des délais de clôture des comptes;;;;;;;;"Validation du planning de cloture locale établi en lien avec les contraintes groupe et locales:
DFC/DPC reçoit de France Télécom le calendrier du reporting, prépare le planning des clôtures mensuelles et annuelles (acteurs, dates et tâches indiqués) suivants les contraintes de FT et de la réglementation locale et informe les services du département comptabilité,le contrôle de gestion et les filiales de sonatel après validation du dfc, le service reporting comptable renseigne l'indicateur date d' envoi du reporting à M+1 dans le tableau de bord dfc/DPC.

Suivi de l'exécution du planning de clôture:
Un planning de clôture des comptes est conçu chaque année pour décrire quelles sont les tâches à effectuer,qui doit les faire , à quel moment doit on les faire. Ce planing annuel est discuté et arrêté pour être distribué à tous les acteurs qui interviennent dans la clôture des comptes, Pendant la période d'arrêté annuelle, une réunion élargie aux filiales se tient périodiquement (tous les lundis) pour suivre l'évolution des tâches d'arrêté défini sur le planning. Lors de ces réunions, les actions à entreprendre sont décrites et validées à la prochaine séance de travail.

";Préventif;Manuelle;1;2;1;;4;1;;2;3;;;;;;;;;;;;;;;;;;;;;;;;;;;;;;;;;;;;;;;;;;;;;;;;;;;;;;;;;;;;;;;;;;;;;;;;;;;;;;;;;;;;;;;;;;;;;;;;;;;;;;;;;;;;;;;;;;;;;;;;;;;;;;;;;;;;;;;;;;;;;;;;;;;;;;;;;;;;;;;;;;;;;;;;;;;;;;;;;;;;;;;;;;;;;;;;;;;;;;;;;;;;;;;;;;;;;;;;;;;;;;;;;;;;;;;;;;;;;;;;;;;;;;;;;;;;;;;;;;;;;;;;;;;;;;;;;;;;;;;;;;;;;;;;;;;;;;;;;;;;;;;;;;;;;;;;;;;;;;;;;;;;;;;;;;;;;;;;;;;;;;;;;;;;;;;;;;;;;;;;;;;;;;;;;;;;;;;;;;;;;;;;;;;;;;;;;;;;;;;;;;;;;;;;;;;;;;;;;;;;;;;;;;;;;;;;;;;;;;;;;;;;;;;;;;;;;;;;;;;;;;;;;;;;;;;;;;;;;;;;;;;;;;;;;;;;;;;;;;;;;;;;;;;;;;;;;;;;;;;;;;;;;;;;;;;;;;;;;;;;;;;;;;;;;;;;;;;;;;;;;;;;;;;;;;;;;;;;;;;;;;;;;;;;;;;;;;;;;;;;;;;;;;;;;;;;;;;;;;;;;;;;;;;;;;;;;;;;;;;;;;;;;;;;;;;;;;;;;;;;;;;;;;;;;;;;;;;;;;;;;;;;;;;;;;;;;;;;;;;;;;;;;;;;;;;;;;;;;;;;;;;;;;;;;;;;;;;;;;;;;;;;;;;;;;;;;;;;;;;;;;;;;;;;;;;;;;;;;;;;;;;;;;
Assurer la gestion financière et comptable;Assurer la production des comptes;Assurer la production des comptes;SNT DFC \ DPC;Elaborer les états financiers;Risque de retard de publication de l'information pour le pilotage;Indisponibilité des ressources humaines clef (accident, maladie, absentéisme, enjeu concurrentiel).;;;;;;;;"La polyvalence des agents est assurée du fait de la nature de l'activité (tous les agents sont des comptables)
Existence de procédures d'arrêtés des comptes";Préventif;Manuelle;1;2;1;;4;1;;2;3;;;;;;;;;;;;;;;;;;;;;;;;;;;;;;;;;;;;;;;;;;;;;;;;;;;;;;;;;;;;;;;;;;;;;;;;;;;;;;;;;;;;;;;;;;;;;;;;;;;;;;;;;;;;;;;;;;;;;;;;;;;;;;;;;;;;;;;;;;;;;;;;;;;;;;;;;;;;;;;;;;;;;;;;;;;;;;;;;;;;;;;;;;;;;;;;;;;;;;;;;;;;;;;;;;;;;;;;;;;;;;;;;;;;;;;;;;;;;;;;;;;;;;;;;;;;;;;;;;;;;;;;;;;;;;;;;;;;;;;;;;;;;;;;;;;;;;;;;;;;;;;;;;;;;;;;;;;;;;;;;;;;;;;;;;;;;;;;;;;;;;;;;;;;;;;;;;;;;;;;;;;;;;;;;;;;;;;;;;;;;;;;;;;;;;;;;;;;;;;;;;;;;;;;;;;;;;;;;;;;;;;;;;;;;;;;;;;;;;;;;;;;;;;;;;;;;;;;;;;;;;;;;;;;;;;;;;;;;;;;;;;;;;;;;;;;;;;;;;;;;;;;;;;;;;;;;;;;;;;;;;;;;;;;;;;;;;;;;;;;;;;;;;;;;;;;;;;;;;;;;;;;;;;;;;;;;;;;;;;;;;;;;;;;;;;;;;;;;;;;;;;;;;;;;;;;;;;;;;;;;;;;;;;;;;;;;;;;;;;;;;;;;;;;;;;;;;;;;;;;;;;;;;;;;;;;;;;;;;;;;;;;;;;;;;;;;;;;;;;;;;;;;;;;;;;;;;;;;;;;;;;;;;;;;;;;;;;;;;;;;;;;;;;;;;;;;;;;;;;;;;;;;;;;;;;;;;;;;;;;;;;;;;
Assurer la gestion financière et comptable;Assurer la production des comptes;Assurer la production des comptes;SNT DFC \ DPC;Elaborer les états financiers;Risque de retard de publication de l'information pour le pilotage;Non respect des délais légaux de publication des comptes;;;;;;;;"Approbation des rapports statutaires par les organes compétents:
DRJ convoque le conseil d'administration et l'assemblée générale dans les délais et les conditions fixés par la loi (OHADA). Des convocations sont envoyées aux administrateurs et actionnaires (pour l'assemblée générale). Il s'assure que les comptes ont été arrêtés par le CA et approuvés par l'AG conformément aux délais et conditions fixés par les dispositions de l'OHADA.
Vérification du respect des délais légaux: 
Les déclarations sont effectuées auprès de l'administration fiscale 4 mois après la clôture contre accusé de réception, de la direction des statistiques,par le chef du département de la fiscalité. Les déclarations nécessaires sont également effectuées auprès de la bourse régionale des valeurs mobilières (BRVM) par le département Finances( 3 mois après la publication des états financiers semestriels et 4 mois après la publication des états financiers annuelle). La publication dans les délais des états financiers sont suivis par DFC/DPC par le biais de son tableau de bord. Le rapport du commissaire aux comptes est établi pour les arrêtés légaux (juin et décembre).
Possibilité de demander une dérogation en cas de retard";Préventif;Manuelle;1;2;1;;4;1;;2;3;;;;;;;;;;;;;;;;;;;;;;;;;;;;;;;;;;;;;;;;;;;;;;;;;;;;;;;;;;;;;;;;;;;;;;;;;;;;;;;;;;;;;;;;;;;;;;;;;;;;;;;;;;;;;;;;;;;;;;;;;;;;;;;;;;;;;;;;;;;;;;;;;;;;;;;;;;;;;;;;;;;;;;;;;;;;;;;;;;;;;;;;;;;;;;;;;;;;;;;;;;;;;;;;;;;;;;;;;;;;;;;;;;;;;;;;;;;;;;;;;;;;;;;;;;;;;;;;;;;;;;;;;;;;;;;;;;;;;;;;;;;;;;;;;;;;;;;;;;;;;;;;;;;;;;;;;;;;;;;;;;;;;;;;;;;;;;;;;;;;;;;;;;;;;;;;;;;;;;;;;;;;;;;;;;;;;;;;;;;;;;;;;;;;;;;;;;;;;;;;;;;;;;;;;;;;;;;;;;;;;;;;;;;;;;;;;;;;;;;;;;;;;;;;;;;;;;;;;;;;;;;;;;;;;;;;;;;;;;;;;;;;;;;;;;;;;;;;;;;;;;;;;;;;;;;;;;;;;;;;;;;;;;;;;;;;;;;;;;;;;;;;;;;;;;;;;;;;;;;;;;;;;;;;;;;;;;;;;;;;;;;;;;;;;;;;;;;;;;;;;;;;;;;;;;;;;;;;;;;;;;;;;;;;;;;;;;;;;;;;;;;;;;;;;;;;;;;;;;;;;;;;;;;;;;;;;;;;;;;;;;;;;;;;;;;;;;;;;;;;;;;;;;;;;;;;;;;;;;;;;;;;;;;;;;;;;;;;;;;;;;;;;;;;;;;;;;;;;;;;;;;;;;;;;;;;;;;;;;;;;;;;;;
Assurer la gestion financière et comptable;Assurer la production des comptes;Assurer la production des comptes;SNT DFC \ DPC;Enregistrer et analyser les opérations comptables;Risque de fraude;"Irrégularité dans l'établissement des états de rapprochement bancaires et caisse
";;;;;;;;" - Rapprochement quotidien sauf pour certaines banques étrangères pour lesquelles un rapprochement mensuel est effectué
- Analyse et pilotage mensuels des suspens bancaires de tous les comptes bancaires
 - Séparation des tâches
- Rapprochement des opérations de caisse";Préventif;Manuelle;1;2;2;;2;;2;2;3;;;;;;;;;;;;;;;;;;;;;;;;;;;;;;;;;;;;;;;;;;;;;;;;;;;;;;;;;;;;;;;;;;;;;;;;;;;;;;;;;;;;;;;;;;;;;;;;;;;;;;;;;;;;;;;;;;;;;;;;;;;;;;;;;;;;;;;;;;;;;;;;;;;;;;;;;;;;;;;;;;;;;;;;;;;;;;;;;;;;;;;;;;;;;;;;;;;;;;;;;;;;;;;;;;;;;;;;;;;;;;;;;;;;;;;;;;;;;;;;;;;;;;;;;;;;;;;;;;;;;;;;;;;;;;;;;;;;;;;;;;;;;;;;;;;;;;;;;;;;;;;;;;;;;;;;;;;;;;;;;;;;;;;;;;;;;;;;;;;;;;;;;;;;;;;;;;;;;;;;;;;;;;;;;;;;;;;;;;;;;;;;;;;;;;;;;;;;;;;;;;;;;;;;;;;;;;;;;;;;;;;;;;;;;;;;;;;;;;;;;;;;;;;;;;;;;;;;;;;;;;;;;;;;;;;;;;;;;;;;;;;;;;;;;;;;;;;;;;;;;;;;;;;;;;;;;;;;;;;;;;;;;;;;;;;;;;;;;;;;;;;;;;;;;;;;;;;;;;;;;;;;;;;;;;;;;;;;;;;;;;;;;;;;;;;;;;;;;;;;;;;;;;;;;;;;;;;;;;;;;;;;;;;;;;;;;;;;;;;;;;;;;;;;;;;;;;;;;;;;;;;;;;;;;;;;;;;;;;;;;;;;;;;;;;;;;;;;;;;;;;;;;;;;;;;;;;;;;;;;;;;;;;;;;;;;;;;;;;;;;;;;;;;;;;;;;;;;;;;;;;;;;;;;;;;;;;;;;;;;;;;;;;
Assurer la gestion financière et comptable;Assurer la production des comptes;Assurer la production des comptes;SNT DFC \ DPC;Enregistrer et analyser les opérations comptables;Risque de fraude;Non respect des principes de séparation des tâches;;;;;;;;"- Vérification du respect de la séparation des tâches
Chaque agent effectue les tâches prévues dans sa fiche de poste, tâches définies pour respecter la séparation des tâches incompatibles, le chef de service supervise les travaux des agents, le chef de département supervise les chefs de service.
- Sécurisation des accès à Oracle
L'utilisateur ou son responsable demande par notes la création d' un profil dans Oracle au support fonctionnel qui vérifie si l'utlisateur n' avait pas de profil en rentrant le numéro de matricule, le support (DFC/SMP) crée les responsabilités avant de transmettre à la DSI pour création du profil et des accès.";Préventif;Manuelle;1;2;2;;2;;2;2;3;;;;;;;;;;;;;;;;;;;;;;;;;;;;;;;;;;;;;;;;;;;;;;;;;;;;;;;;;;;;;;;;;;;;;;;;;;;;;;;;;;;;;;;;;;;;;;;;;;;;;;;;;;;;;;;;;;;;;;;;;;;;;;;;;;;;;;;;;;;;;;;;;;;;;;;;;;;;;;;;;;;;;;;;;;;;;;;;;;;;;;;;;;;;;;;;;;;;;;;;;;;;;;;;;;;;;;;;;;;;;;;;;;;;;;;;;;;;;;;;;;;;;;;;;;;;;;;;;;;;;;;;;;;;;;;;;;;;;;;;;;;;;;;;;;;;;;;;;;;;;;;;;;;;;;;;;;;;;;;;;;;;;;;;;;;;;;;;;;;;;;;;;;;;;;;;;;;;;;;;;;;;;;;;;;;;;;;;;;;;;;;;;;;;;;;;;;;;;;;;;;;;;;;;;;;;;;;;;;;;;;;;;;;;;;;;;;;;;;;;;;;;;;;;;;;;;;;;;;;;;;;;;;;;;;;;;;;;;;;;;;;;;;;;;;;;;;;;;;;;;;;;;;;;;;;;;;;;;;;;;;;;;;;;;;;;;;;;;;;;;;;;;;;;;;;;;;;;;;;;;;;;;;;;;;;;;;;;;;;;;;;;;;;;;;;;;;;;;;;;;;;;;;;;;;;;;;;;;;;;;;;;;;;;;;;;;;;;;;;;;;;;;;;;;;;;;;;;;;;;;;;;;;;;;;;;;;;;;;;;;;;;;;;;;;;;;;;;;;;;;;;;;;;;;;;;;;;;;;;;;;;;;;;;;;;;;;;;;;;;;;;;;;;;;;;;;;;;;;;;;;;;;;;;;;;;;;;;;;;;;;;;;;
Assurer la gestion financière et comptable;Assurer la production des comptes;Assurer la production des comptes;SNT DFC \ DPC;Etablir les ordres de paiement aux tiers autres que fournisseurs;Risque de fraude;Paiement indu;;;;;;;;" - Séparation des tâches de comptabilisation et de trésorerie et de contrôle par rapprochements bancaires
- Pour tous les paiements, des contrôles bloquants ne permettent pas l'indication d'un nom de bénéficiaire différent de celui du titulaire du compte
- Rejet de tout paiement par la banque pour des bénéficiaires different du nom du titulaire du compte 
- DFC, DGA, DG ne detiennent pas profil Oracle de paiement pour effectuer et ni de lettre chèque 
- Rejet de tout paiement par la banque de tout bénéficiaire dont le nom sur le chèque est différent du nom sur la pièce d'identité";Préventif;Manuelle;1;2;2;;2;;2;2;3;;;;;;;;;;;;;;;;;;;;;;;;;;;;;;;;;;;;;;;;;;;;;;;;;;;;;;;;;;;;;;;;;;;;;;;;;;;;;;;;;;;;;;;;;;;;;;;;;;;;;;;;;;;;;;;;;;;;;;;;;;;;;;;;;;;;;;;;;;;;;;;;;;;;;;;;;;;;;;;;;;;;;;;;;;;;;;;;;;;;;;;;;;;;;;;;;;;;;;;;;;;;;;;;;;;;;;;;;;;;;;;;;;;;;;;;;;;;;;;;;;;;;;;;;;;;;;;;;;;;;;;;;;;;;;;;;;;;;;;;;;;;;;;;;;;;;;;;;;;;;;;;;;;;;;;;;;;;;;;;;;;;;;;;;;;;;;;;;;;;;;;;;;;;;;;;;;;;;;;;;;;;;;;;;;;;;;;;;;;;;;;;;;;;;;;;;;;;;;;;;;;;;;;;;;;;;;;;;;;;;;;;;;;;;;;;;;;;;;;;;;;;;;;;;;;;;;;;;;;;;;;;;;;;;;;;;;;;;;;;;;;;;;;;;;;;;;;;;;;;;;;;;;;;;;;;;;;;;;;;;;;;;;;;;;;;;;;;;;;;;;;;;;;;;;;;;;;;;;;;;;;;;;;;;;;;;;;;;;;;;;;;;;;;;;;;;;;;;;;;;;;;;;;;;;;;;;;;;;;;;;;;;;;;;;;;;;;;;;;;;;;;;;;;;;;;;;;;;;;;;;;;;;;;;;;;;;;;;;;;;;;;;;;;;;;;;;;;;;;;;;;;;;;;;;;;;;;;;;;;;;;;;;;;;;;;;;;;;;;;;;;;;;;;;;;;;;;;;;;;;;;;;;;;;;;;;;;;;;;;;;;;;;
