Risque;Causes réelles ou potentielles;Libellé;Nom Porteur;Email porteur;Date début;Date fin;Avancement du plan d'action;Statut du plan d'action;CONTRÔLE DESCRIPTION;Type;Méthode;Probabilité;Gravité;Finance;Commercial;RH;Juridik;Image;Criticité;Maturité
Risque de non respect des dispositions juridiques et règlementaires;appels vers les clients non contrôlés;Vérifier auprès de DRJ la réglementation accompagnant les appels vers les clients: fréquence, plages horaires, etc et l'inclure dans le contrat avec les partenaires;Jean Charles Mendy;;;15/12/17;;Non échu;;;;2;2;1;2;;2;3;4;
Risque de manque de performance économique des offres/projets;cannibalisation des offres SVA du type sms, etc;Définir dans le bp, un tarif garantissant la compétitivité des offres existantes du types web to sms, etc;Jean Charles Mendy;;;15/12/17;;Non échu;;;;2;1;1;;;;;2;
Risque de manque de performance économique des offres/projets;manque de fiabilité des données de facturation;Tester la facturation par palier pour s'assurer de la fiabilité des données de facturation;Jean Charles Mendy;;;30/01/17;;Non échu;;;;1;1;1;;;;;1;
Risque de non respect des dispositions juridiques et règlementaires;absence de contrôle sur l'usage / les messages vocaux diffusés par les partenaires;"Vérification de la conformité du contenu de l'offre du client 
Inclure une clause de non responsabilité de Sonatel sur le contenu des messages vocaux dans le contrats avec les spartenaires";Jean Charles Mendy;;;15/12/17;;Non échu;;;;3;2;1;2;;2;3;6;
Risque de fraude;terminaison d'appels à travers l'API voix;Voir avec DFC/FRA les dispositifs à mettre en place pour prévenir/corriger ce type de fraude;Jean Charles Mendy;;;15/12/17;;Non échu;;;;2;2;1;;;;2;3;
