Risque (points d'attention);Causes (facteurs à l'origine de ces points d'attention);descrption du plan d'action;Nom Porteur;Email porteur;Date début;Date fin;Avancement du plan d'action;Statut du plan d'action;CONTRÔLE DESCRIPTION (ce qui est mis en place pour éviter ou maitriser la survenance du risque);Type de contrôle;Méthode de contrôle;Probabilité;Synthèse = gravité;Finance;RH;Image;Juridik;Commercial;Criticité;Matirié
Risque de lancement de projet non fonctionnel;Fonctionnalités de la box inadaptées aux besoins du projet;"Bien spécifier les besoins sur la BOX et s'assurer que les modèles sont adaptés
Dérouler les tests sur les box pour s'assurer que les fonctionnalités nécessaires sont bien embarquées";Rosalie Cisse;RosalieReineNgone.CISSE@orange-sonatel.com;;17/04/2018;tests voix sur IP sur la funbox en cours;Soldé;tests concluants sur la funbox et la livebox PROV4;Préventif;manuelle;1;2;1;1;3;;2;;3
Risque de non rentabilité des offres/projets;box choisis pour la voix only non évolutifs (n'intègre pas l'adsl, etc) ;"Bien spécifier les besoins sur la BOX et s'assurer que les modèles sont adaptés
Dérouler les tests sur les box pour s'assurer que les fonctionnalités nécessaires sont bien embarquées";Rosalie Cisse;RosalieReineNgone.CISSE@orange-sonatel.com;;17/04/2018;;Soldé;Pour la voix only: choix de la funbox dont les test sont concluants.;Préventif;manuelle;1;1;1;;;;;;3
Risque de non respect des engagements commerciaux;Répercussion du prix de la box au client pour les offres voix only;"Définir avec le CGBU le mode de comptabilisation des box: facturation au client ou pas?
Solidarité avec le  projet IMS (centraux)";Rosalie Cisse;RosalieReineNgone.CISSE@orange-sonatel.com;;17/04/2018;;Soldé;;;;1;1;1;;;;;;3
Risque d'indisponibilité du service;coupure d'électricité - défaut d'autonomie des modems - perte de service;"Vérifier si les BOX ont une autonomie
Sinon identifier avec le contributeur technqiue une solition paliative aux coupures d'électricité";Rosalie Cisse;RosalieReineNgone.CISSE@orange-sonatel.com;;30/05/2018;tests du call forwarding sur un numéro au choix du client en cours pour la récupération des appels en cas de coupure d'électricité;en cours;;;;3;2;1;1;3;;2;;1
